{
  "$schema": "https://json.schemastore.org/claude-code-marketplace.json",
  "name": "fk-dev-digest-marketplace",
  "owner": {
    "name": "Fel Kost",
    "email": "teacherfkv@gmail.com"
  },
  "description": "SDD engineering workflow, paved-path knowledge skills, architecture review, and research tools extracted from the DevDigest harness.",
  "plugins": [
    {
      "name": "engineering-paved-path",
      "source": "./plugins/engineering-paved-path",
      "description": "Canonical knowledge skills for the TypeScript stack: React/Next.js, Fastify, Drizzle, PostgreSQL, Zod, testing, security, Mermaid, onion architecture.",
      "category": "knowledge",
      "keywords": [
        "skills",
        "best-practices",
        "typescript",
        "react",
        "fastify",
        "drizzle",
        "security"
      ]
    },
    {
      "name": "research-tools",
      "source": "./plugins/research-tools",
      "description": "Generic read-only researcher agent, doc-writer agent + skill, and a dependency audit skill.",
      "category": "research",
      "keywords": ["research", "documentation", "dependencies", "read-only"]
    },
    {
      "name": "architecture-review",
      "source": "./plugins/architecture-review",
      "description": "Read-only architecture reviewers that ground every finding in the host repository's own architecture docs.",
      "category": "review",
      "keywords": ["architecture", "review", "onion", "layering", "read-only"]
    },
    {
      "name": "sdd-engineering",
      "source": "./plugins/sdd-engineering",
      "description": "Complete SDD workflow: spec-creator, implementation-planner, implementer, test-writer, plan-verifier agents plus run-plan/implement orchestrators, workflow-retro, and engineering-insights.",
      "category": "workflow",
      "keywords": ["sdd", "spec", "plan", "implement", "verify", "retro", "pipeline"]
    },
    {
      "name": "agent-ml-interviewer",
      "source": "./plugins/agent-ml-interviewer",
      "description": "21 decision-procedure skills for classical ML, Bayesian inference, forecasting, and LLM/RL parameter choice. Content is in Ukrainian — quarantined from the marketplace's English-only content checks (see validate-marketplace.mjs).",
      "category": "knowledge",
      "keywords": [
        "machine-learning",
        "hyperparameters",
        "metrics",
        "bayesian",
        "forecasting",
        "llm",
        "reinforcement-learning"
      ]
    },
    {
      "name": "eda-skills",
      "source": "./plugins/eda-skills",
      "description": "4 linked skills that turn raw data into a documented, leakage-safe, validated dataset. Content is in Ukrainian — quarantined from the marketplace's English-only content checks (see validate-marketplace.mjs).",
      "category": "knowledge",
      "keywords": [
        "eda",
        "data-quality",
        "feature-engineering",
        "dataset-validation",
        "data-leakage"
      ]
    },
    {
      "name": "ai-gen",
      "source": "./plugins/ai-gen",
      "description": "Senior-developer/mentor agent with 6 linked skills for generative-AI engineering: model-class selection, LLM/VLM/OpenRouter choice, agent architectures (ReAct, RAG, multi-agent, human-in-the-loop) with MCP/memory/vector DBs, deployment, evaluation/optimization, and worked LangChain/LangGraph + React 19 examples. Content is in Ukrainian — quarantined from the marketplace's English-only content checks (see validate-marketplace.mjs).",
      "category": "knowledge",
      "keywords": [
        "generative-ai",
        "llm",
        "rag",
        "multi-agent",
        "mcp",
        "vector-database",
        "openrouter",
        "langgraph"
      ]
    }
  ],
  "renames": {}
}
